jid,sfzh,xm,gj,address
294,321001194311051148,朱桂芝,德国,香港特别行政区桂英市新城台北街b座 927929
295,451425196906279740,王桂芝,印度尼西亚,上海市桂英县牧野辽阳街B座 931924
296,440804194507184208,姜丽,印度尼西亚,辽宁省郑州县长寿柳州街G座 970486
297,451023197403075009,高丽华,帕劳,重庆市成都县高港韩路G座 427610
298,430900199501302649,雷红梅,斯威士兰,吉林省郑州市黄浦黄街T座 703075
299,130826199101195642,黄志强,摩尔多瓦,甘肃省成市南长黄路B座 137400
300,530428197409130040,王宁,中国,四川省齐齐哈尔县高明孟路E座 802587
301,130125197307187441,张旭,巴林,湖南省冬梅市怀柔潜江街r座 986114
302,152200196310025805,林桂珍,墨西哥,内蒙古自治区辽阳县浔阳相街I座 127169
303,511900198708166273,李秀英,多米尼加共和国,宁夏回族自治区乌鲁木齐县南溪南京街l座 787744
304,420117196110250309,李秀梅,巴布亚新几内亚,湖北省帆县高明澳门街x座 580021
305,370704197402099322,沈红,萨尔瓦多,新疆维吾尔自治区岩县南溪梧州街z座 859560
306,350526198010063126,毛瑞,黎巴嫩,浙江省成市清城永安路A座 899491
307,622924199305117794,张桂香,吉尔吉斯斯坦,香港特别行政区石家庄县南长梁街A座 930153
308,341821194905212538,孔凯,所罗门群岛,广西壮族自治区帅县翔安梧州街e座 258709
309,220301193902221054,金旭,南非,江西省桂香市兴山西宁路S座 510943
310,440783200007203765,桑凤英,以色列,青海省凤兰县高明周街c座 779219
311,45048119660302226X,杨刚,马拉维,广东省想县秀英成都路l座 522812
312,360202194405220049,张秀云,瓜德罗普岛,天津市桂花市永川巢湖路B座 707297
313,540102195707068575,石文,约旦,广东省金凤县朝阳赵街h座 659247
314,513430196703319190,杨畅,阿鲁巴岛,湖南省桂芝市崇文六盘水路S座 941395
315,450481197409040936,何秀梅,法属圭亚那,吉林省秀荣县兴山大冶路p座 583243
316,440201194506287967,彭建军,塔吉克斯坦,澳门特别行政区潜江县房山阮街Q座 142690
317,43128119331116295X,杨东,安哥拉,山西省凤兰县永川蔡街j座 186907
318,37132719850617716X,岳伟,威克岛,吉林省建国市高坪沈阳街m座 146500
319,230302198711054733,刘桂芝,多哥,内蒙古自治区建市东丽葛街j座 815474
320,500115199305034762,崔金凤,塞内加尔,河南省梅县山亭胡街X座 554702
321,370211197305243747,郭敏,新喀里多尼亚群岛,西藏自治区邯郸市东城莫路R座 962940
322,210521198206128435,王桂珍,开曼群岛,新疆维吾尔自治区秀华市友好潜江路B座 758393
323,500109198112294451,符明,多米尼克国,宁夏回族自治区沈阳县双滦陈街B座 489401
324,441322194202132550,万梅,摩洛哥,青海省丽市大东张街c座 192369
325,350581195201222880,王波,尼日利亚,陕西省平市东城南京街Q座 819391
326,420205193803048767,黄洁,伊郎,上海市璐县安次嘉禾街j座 374381
327,230826199912052075,赵志强,法属波里尼西亚,福建省秀珍市安次北京街r座 489253
328,513321193010119123,徐冬梅,约旦,湖北省深圳市清河孟街y座 218341
329,51332719750419586X,张洋,泰国,河南省小红县长寿广州路K座 360962
330,510322198502058853,陈飞,拉脱维亚,江西省辽阳市南长兴安盟街w座 503866
331,15082419600801797X,李建平,巴哈马国,浙江省军市华龙田街P座 928750
332,445301197607120991,余洁,莱索托,安徽省沈阳县西夏孙路s座 586877
333,542222195305276307,汪娟,古巴,河南省梧州县普陀嘉禾街j座 342714
334,411722200101225226,冼健,新加坡,香港特别行政区玉珍市清河袁路k座 910223
335,130622200103200109,张建国,克罗地亚,四川省红县静安哈尔滨街T座 931304
336,410182195112051558,张玲,斯里兰卡,内蒙古自治区帆县秀英哈尔滨路R座 490992
337,340827193810051578,陈丽丽,加纳,宁夏回族自治区桂花市华龙熊路l座 836198
338,421123194302213982,贺玉珍,荷兰,山东省云市高坪巢湖路t座 751238
339,542123196706145055,刘雷,圭亚那,广东省健市东城东莞街L座 702492
340,141022199507243230,冀俊,喀麦隆,天津市小红市安次梧州街c座 119497
341,542226198611298925,姜磊,科科斯岛,湖南省桂珍市西夏沈阳路s座 889633
342,511903199207233080,严玉梅,多米尼加共和国,贵州省杨市高港段路I座 197003
343,41100219541127515X,贾建平,科摩罗,江西省惠州市孝南刘街h座 730970
344,532324196806061831,宋娜,冈比亚,内蒙古自治区武汉市金平东莞路a座 929831
345,23050219690323081X,王秀英,瑞士,广东省巢湖县滨城广州街E座 980159
346,621122194907091675,王秀云,洪都拉斯,青海省北京县黄浦成都路y座 384216
347,331082196012262286,戴慧,阿根廷,天津市济南县蓟州北京街R座 859980
348,411724193410093263,杨建平,泰国,四川省六安市平山王街a座 531152
349,131082194510118168,王淑珍,印度尼西亚,新疆维吾尔自治区琴县西夏何街t座 529715
350,512001196112200142,朱洁,塞浦路斯,天津市玉珍县滨城刘路R座 395791
351,41160119690515624X,贾晨,维尔京群岛和圣罗克伊,山东省合肥县东城黎路T座 302336
352,44162319690103568X,伍文,南非,台湾省志强县秀英长春街w座 684895
353,620000196010217194,朱柳,直布罗陀,天津市沈阳市沙湾罗街r座 195509
354,361122195806205638,韦玉珍,喀麦隆,河南省银川市南长梧州街B座 966657
355,150627194210207821,梁浩,中非,江苏省文县魏都济南街r座 440160
356,320481195406101782,高建华,马绍尔群岛,新疆维吾尔自治区深圳市淄川王路h座 550863
357,330000194510017596,龚淑兰,马约特岛,西藏自治区潮州县江北济南街j座 738977
358,513424197610271404,李丹,巴拿马,北京市静市清河郑路I座 320038
359,522732199801305378,龙华,吉布提,贵州省贵阳市山亭焦街D座 513862
360,210703199702072285,王成,喀麦隆,福建省斌市朝阳台北路c座 607723
361,231084199104026515,马涛,纳米比亚,海南省萍县新城成都路u座 321369
362,621023195103251552,孙秀华,白俄罗斯,云南省婷市平山哈尔滨路L座 517632
363,430381193403182928,杨东,喀麦隆,江苏省合肥县白云长沙路e座 368395
364,610822196806201630,萧敏,波兰,天津市北镇县南溪王街z座 620604
365,460106198708205227,张建军,老挝,广东省海口市牧野杨街U座 242431
366,120113199010090608,程华,秘鲁,河北省浩县合川柳州路J座 373752
367,31010819620512168X,张宁,巴基斯坦,甘肃省玉英县沈北新李街Q座 833465
368,421321194009285192,李瑜,巴拿马,重庆市重庆市白云佛山路n座 465221
369,53292719710124508X,潘军,亚美尼亚,江西省贵阳市长寿王路M座 830811
370,340801194705309355,徐玉英,贝宁,吉林省红霞市南溪天津路X座 479780
371,511523194104029037,谭海燕,多米尼克国,西藏自治区荆门县海陵昆明路l座 833500
372,210102198711110892,路伟,朝鲜,西藏自治区桂花市沈北新黄街F座 471015
373,411122200006123544,李建国,伯利兹,天津市南宁市秀英欧街Y座 791612
374,130526196212233664,何勇,波斯尼亚和黑塞哥维那,江西省柳县西峰何路r座 745091
375,440511194406163974,陈婷婷,瓦里斯和富士那群岛,西藏自治区鑫市门头沟济南街O座 541021
376,510681198801256354,朱红,伯利兹,河南省阜新县永川马鞍山街Z座 460899
377,150929196202111916,房婷婷,尼日利亚,福建省沈阳县山亭刘路m座 445134
378,45122419640601831X,吴玉兰,直布罗陀,福建省凤兰县门头沟何路W座 569632
379,540127196208146315,姚浩,斯里兰卡,宁夏回族自治区兴城县兴山陈路o座 867395
380,360681196703300254,罗秀梅,爱沙尼亚,吉林省岩县新城重庆街p座 892527
381,520100199408232947,徐晶,吉布提,浙江省淑英县永川济南路g座 505943
382,530630199706123703,魏丹,厄瓜多尔,湖南省杰市大兴兰州街R座 961486
383,220421193908108037,孙秀华,巴西,黑龙江省东县白云西宁街g座 758442
384,540224199604206703,安丹,苏里南,广西壮族自治区凤英市兴山廖路N座 102189
385,210300194512053004,李玉兰,吉布提,河南省兴城市城北张街J座 524357
386,140600197201027388,贾楠,立陶宛,湖南省邯郸县合川长沙路R座 176332
387,150105195812211413,孙杰,津巴布韦,青海省佛山市安次李路x座 241680
388,460203197510066470,赵桂荣,赞比亚,新疆维吾尔自治区桂芝市怀柔吕路c座 334214
389,411724196402208263,曾文,阿尔巴尼亚,西藏自治区贵阳县兴山迟街V座 434223
390,321003197806160078,范红,奥地利,陕西省欢市怀柔卢街J座 313298
391,230206198308104219,徐琴,韩国,江苏省呼和浩特市山亭通辽街e座 295217
392,350322199310092891,傅芳,百慕大群岛,安徽省彬县海港陈路T座 488701
393,15040219310502027X,罗秀珍,索马里,湖北省辽阳市兴山刘街i座 101820
394,653224198808297110,夏玲,马里,台湾省强市翔安吴街a座 372337
395,610526194401287771,吴莹,波多黎各,安徽省林市城东卢街t座 438478
396,610901193710214533,王荣,斐济,山东省冬梅县锡山贵阳街K座 529696
397,520325198001091373,焦莹,特克斯和凯科斯群岛,陕西省天津市城东刘路O座 386697
398,630123198501030675,林霞,以色列,贵州省哈尔滨市龙潭马路v座 615226
399,150204193612099586,欧利,摩尔多瓦,福建省重庆县山亭李路W座 931743
400,120114195205299071,周龙,俄罗斯,海南省六盘水县平山上海路C座 913400
401,150201197309306561,李瑜,丹麦,河南省柳州县和平沈阳街n座 387519
402,410322195308169763,孙静,塞内加尔,浙江省燕市涪城北京路I座 444795
403,46900619590819981X,韦勇,黎巴嫩,辽宁省南宁市海陵南京街h座 308903
404,34162219650812810X,李桂花,意大利,江西省六安市西夏刘街B座 244154
405,140224198308307172,殷浩,朝鲜,贵州省秀英县浔阳王街h座 960527
406,360727199910120580,杨凤英,圣马力诺,天津市南京县蓟州郭路o座 115677
407,510107198712048982,黄建,博茨瓦纳,河南省丽娟县吉区福州街O座 760753
408,130300195101033054,赖海燕,密克罗尼西亚,福建省银川市吉区彭街P座 901541
409,540221194009178961,许玉珍,法属波里尼西亚,香港特别行政区雪梅县南湖张路p座 539225
410,520201196401304168,王杨,哥伦比亚,香港特别行政区梅市梁平黄街h座 897278
411,150421196111222137,张楠,巴林,广西壮族自治区石家庄市门头沟彭路d座 912873
412,421222195101135985,钟彬,多米尼加共和国,黑龙江省佛山市璧山陶路F座 307873
413,640202198310230725,冉燕,巴布亚新几内亚,安徽省莹市高港夏街O座 205153
414,62040119380729620X,许杨,卡塔尔,四川省瑜县永川阜新街S座 385832
415,450126193411244023,王瑞,罗马尼亚,西藏自治区汕尾市沈河宜都路p座 208400
416,350926198306036700,杨峰,越南,湖北省潮州县双滦纪路g座 212484
417,410182199506308211,韩淑华,危地马拉,台湾省洋县吉区丁路D座 883652
418,370901193811151156,李兰英,古巴,云南省台北县孝南嘉禾路p座 386898
419,150121193705306653,雷坤,尼日利亚,宁夏回族自治区想市平山邯郸街W座 913835
420,330100197906027618,丁莹,朝鲜,黑龙江省沈阳市锡山永安路P座 405304
421,630102196201278029,郑洋,哈萨克斯坦,四川省健市长寿辽阳街K座 121047
422,140122193307162900,陈玉兰,日本,新疆维吾尔自治区辛集县六枝特芦街A座 736097
423,370783194301244035,黄波,马约特岛,广东省重庆县吉区福州街l座 259004
424,500241194007191802,范想,亚美尼亚,湖南省福州市璧山沈路E座 856974
425,370203199406148158,张玲,桑给巴尔,山东省秀芳市门头沟母路T座 436584
426,542622193604028971,殷琳,芬兰,山东省柳州县友好乌鲁木齐路O座 872021
427,510500195010087622,王瑞,塞浦路斯,重庆市沈阳县静安张路A座 768622
428,360983199202013161,姚明,柬埔塞,黑龙江省军县牧野阜新街O座 653180
429,130923196007051602,韩军,百慕大群岛,广西壮族自治区荆门市静安南昌街v座 692664
430,371427197104185256,陈瑜,安提瓜和巴布达,安徽省梅县孝南胡路X座 177462
431,341823194509245365,粟凯,蒙特塞拉特岛,北京市淮安县丰都太原街t座 107288
432,130632197107087818,赵佳,匈牙利,浙江省颖县闵行澳门路G座 547419
433,230200199706104253,丁健,蒙古,内蒙古自治区潜江县吉区曾路T座 261163
434,430811194309249391,刘玉,法国,河北省惠州市淄川李街i座 456846
435,210922194806290399,邹瑜,蒙特塞拉特岛,陕西省帅县南湖周路l座 496524
436,130528196508264374,黄建国,波多黎各,福建省洁市孝南刘路Q座 831273
437,430781195801043430,赵波,哥斯达黎加,北京市东莞县南长马鞍山街r座 470267
438,44011419881116612X,卫晨,土耳其,湖南省嘉禾县淄川梧州路z座 695535
439,130700194904151692,刘凤兰,莫桑比克,山西省琳县华龙周路y座 325900
440,420626199212142840,姜凯,罗马尼亚,上海市南昌县城北呼和浩特路i座 926684
441,340825197210291303,江斌,韩国,陕西省惠州市静安全路Z座 669149
442,450512196612082785,卢淑珍,哥斯达黎加,河北省西安县龙潭宜都路z座 457388
443,530324199908171021,黄雪梅,斯洛文尼亚,河北省娜县永川沈阳路c座 909591
444,330601196207228532,丁小红,马里亚纳群岛,吉林省秀梅县闵行王路y座 461182
445,410327194305164999,赵畅,叙利亚,贵州省贵阳市崇文陈路O座 481378
446,440300200010138316,梅磊,桑给巴尔,吉林省西安县门头沟长沙路Q座 402116
447,431024195108276493,韩静,摩纳哥,山东省柳州县徐汇海门路v座 697863
448,341122195812221171,丁龙,阿拉伯联合酋长国,山西省荣市门头沟王路j座 978122
449,620503198104173730,胡洁,赞比亚,广东省成都县沙湾香港街U座 491788
450,41152119680808001X,李秀荣,伊郎,湖北省阜新县清河台北路q座 148738
451,371423198305170500,张林,利比里亚,河南省汕尾县西峰南昌街e座 708204
452,131024196904128639,朱桂英,图瓦卢,四川省齐齐哈尔市清城兰州街A座 314439
453,220702197106045244,卿杰,赞比亚,浙江省兰州县长寿谭街V座 330186
454,150822195801175167,郑金凤,吉尔吉斯斯坦,内蒙古自治区桂芳市东丽解路B座 534580
455,350601197412280821,陈建国,布基纳法索,澳门特别行政区辉市沙市东莞街m座 280104
456,450000196508047223,尹伟,梵蒂冈,江西省明市南湖邱街X座 259261
457,150502196308222380,冯玉珍,芬兰,云南省台北市闵行银川街f座 697484
458,130525195702018608,张坤,科摩罗,河南省红霞县清浦北京街D座 332544
459,371102197104039220,王梅,肯尼亚,江西省南昌县海港深圳街i座 173414
460,430702199209121658,梁超,老挝,福建省想县西夏白路o座 892598
461,510681199408133512,陈凯,突尼斯,辽宁省兴安盟市大兴南京街o座 831020
462,460101198503251463,李文,斯里兰卡,内蒙古自治区莉县萧山兴安盟路M座 228054
463,210600196002298760,李晶,海地,山西省梅县滨城黄路q座 411020
464,410622198411229568,杨秀华,所罗门群岛,安徽省阳县东丽上海路Q座 344848
465,321102196710045563,阳勇,圣多美和普林西比,甘肃省淑英县永川澳门街C座 975189
466,451122199901276215,龙畅,维尔京群岛和圣罗克伊,贵州省潜江市海陵齐齐哈尔街x座 238381
467,510100194512105046,赵晨,中华人民共和国,云南省成市沙市马路f座 821498
468,430923194007061183,张雪,乌兹别克斯坦,澳门特别行政区佛山市朝阳合肥路T座 922509
469,42130319470921478X,张淑珍,毛里求斯,贵州省拉萨市上街丁街q座 826156
470,210411194106283490,迟旭,阿富汗,宁夏回族自治区雪梅县徐汇北京街J座 438554
471,220102193206077701,信英,蒙特塞拉特岛,宁夏回族自治区南宁市江北南京街y座 678687
472,140823196006169752,黄秀荣,波斯尼亚和黑塞哥维那,湖南省洋县大东兴安盟路u座 813912
473,130929195409270684,王凯,特立尼达和多巴哥,湖南省北镇县沈河澳门街q座 934850
474,130433195901310147,王秀荣,土库曼斯坦,广东省太原县大东李街Y座 335165
475,431121198702081904,雷建平,希腊,江西省上海县安次辛集路c座 455874
476,610122194504296294,田丽,马约特岛,浙江省宁德市山亭兰州路N座 927321
477,360726195909284110,邓俊,墨西哥,四川省马鞍山市安次北镇街B座 129651
478,431223198208141965,颜秀荣,瑞典,广东省玉华县大东徐路O座 299701
479,350629197609276101,夏芳,中途岛,宁夏回族自治区台北市西夏济南街g座 853398
480,140829197904043062,张静,法属波里尼西亚,广西壮族自治区关岭县徐汇林路x座 656978
481,429006193907012471,任英,利比亚,宁夏回族自治区北镇县金平惠州路t座 897198
482,420101194911252582,王凤兰,新西兰,广东省强市江北朱街i座 493185
483,51140119851221704X,余秀兰,斯威士兰,河北省南京县山亭沈阳路I座 665716
484,411527196506137410,孙明,蒙特塞拉特岛,重庆市晶市清浦梧州街B座 242966
485,230506194809305164,朱燕,阿尔巴尼亚,江西省辛集市浔阳济南路R座 774410
486,320200196710115121,朱鹏,加纳,吉林省合山县沈北新高街p座 350212
487,511722195106120749,陆丽丽,巴西,甘肃省柳州市六枝特方街g座 147993
488,350000195106298013,隆凤英,立陶宛,澳门特别行政区香港县沈河时路S座 520567
489,411422193612184519,王成,秘鲁,山东省帅市和平辛集路T座 901011
490,610624195505262613,徐桂芝,帕劳,香港特别行政区艳县长寿六安路u座 290940
491,130623196208037552,刘博,尼泊尔,吉林省旭市城东淮安路m座 400825
492,440232200012235326,卢龙,马来西亚,四川省敏县萧山马鞍山路D座 988043
493,320509193804218025,唐丽丽,巴西,广东省雷市朝阳王街w座 169764
494,340100198805080379,蔡坤,韩国,湖南省福州市静安李路C座 970719
495,140224200008223487,罗兰英,阿富汗,黑龙江省瑞县闵行汕尾街d座 385848
496,130481197712072688,李桂英,卡塔尔,江西省永安县涪城侯路x座 712649
497,36040319840928618X,关凯,捷克,台湾省昆明市南溪阜新路t座 513983
498,610429194604235377,李飞,保加利亚,江苏省燕县涪城佛山路R座 500512
499,130626196301158091,李红,中途岛,广西壮族自治区台北市朝阳上海路Y座 933034
500,640424196011305723,尹桂香,阿尔巴尼亚,河南省畅县白云梁街x座 328849
501,120221196905092040,樊峰,坦桑尼亚,四川省重庆县清城雷街d座 285101
502,150221197603234410,王志强,土库曼斯坦,辽宁省兴城市徐汇李路u座 143691
503,23082619470403104X,袁旭,南斯拉夫,河北省桂香县高坪福州路T座 122775
504,360430194011065708,景玉梅,托克劳群岛,甘肃省永安县魏都夏街Y座 224121
505,330481196602135695,欧雪梅,马尔代夫,海南省潜江市龙潭上海街X座 605346
506,131023199509049962,何丽娟,维尔京群岛和圣罗克伊,山东省建国县城东倪街G座 959691
507,610403196912265418,杨瑜,梵蒂冈,上海市天津市南溪陈街y座 357501
508,520624195810296543,张金凤,波斯尼亚和黑塞哥维那,黑龙江省银川县兴山黄街Q座 544334
509,211404198412284817,岳建,乍得,宁夏回族自治区淮安市吉区武汉路Y座 650031
510,140822196008145993,翁玉华,加纳,北京市重庆县白云上海街e座 273634
511,140423198406268095,张博,荷属安的列斯群岛,江西省贵阳市涪城西安路h座 968790
512,130823198302111130,刘桂荣,伯利兹,天津市梧州市西峰邓街r座 351756
513,510101194105192636,王洋,叙利亚,河北省小红市白云长春路S座 110056
514,410505196504050902,王成,罗马尼亚,香港特别行政区秀云市孝南澳门街H座 353273
515,542600198206203492,路芳,瑞士,天津市淮安县高明上海街g座 223143
516,140322197307283429,方桂花,爱尔兰,广西壮族自治区佛山市浔阳关岭街i座 893085
517,411700195509277458,刘洁,乌拉圭,宁夏回族自治区霞市大兴沈阳街a座 134649
518,340181198110159396,罗淑英,梵蒂冈,山西省敏县秀英刘路F座 938480
519,620822194709143718,张超,格林纳达,甘肃省娜县永川上海街J座 998258
520,222402198707121759,刘成,斯洛文尼亚,天津市静县双滦西安街D座 608115
521,440114196804120298,王军,博茨瓦纳,湖北省波市双滦呼和浩特街f座 825804
522,320115200011032405,卢玉,塞浦路斯,安徽省荆门县沙湾荆门路Q座 283253
523,441201199307286260,黄丽丽,津巴布韦,天津市广州县清河萧路s座 405926
524,45012319340317701X,林晶,挪威,海南省上海县淄川澳门街y座 409631
525,130602199302212080,郝倩,圭亚那,重庆市荣县海陵陈街F座 161875
526,611001198910144677,黄阳,沙特阿拉伯,河北省永安市蓟州嘉禾街z座 532409
527,440902195804098119,李飞,厄立特里亚,四川省军县金平刘街G座 996931
528,150784198302035175,潘海燕,摩尔多瓦,辽宁省斌县高港何路O座 603403
529,440306199908275715,赵明,阿拉伯联合酋长国,江苏省上海市萧山拉萨路x座 344885
530,522323196201144193,韦坤,中国,黑龙江省凤英市六枝特何路g座 330462
531,522631198211233785,李楠,多米尼加共和国,陕西省建军市永川魏路s座 898220
532,654026197902273631,张桂英,密克罗尼西亚,重庆市刚县南溪林街i座 409671
533,371300200107268777,李佳,蒙古,北京市峰县沈北新刘路x座 721610
534,320707193504131997,李旭,圣卢西亚,江西省北京县双滦拉萨路f座 553417
535,220103199705110602,林秀梅,波兰,澳门特别行政区杭州市华龙罗街m座 120970
536,350304196407256219,杨旭,土耳其,浙江省柳州县花溪刘路A座 350896
537,371725199305112881,周明,扎伊尔,上海市巢湖市沈河李街U座 170983
538,510700194510023533,薛晨,马约特岛,浙江省玉市新城张家港路r座 427158
539,652927197007310276,孙桂芳,尼日尔,内蒙古自治区琴市房山张路j座 939857
540,330726193612150512,杨鹏,印度尼西亚,江苏省大冶市朝阳长春街l座 927361
541,350825197105232178,谢英,丹麦,浙江省辉县大兴周街I座 248349
542,370901195005066116,喻丽丽,斯洛伐克,甘肃省南宁县沙湾王路u座 404577
543,654002193510272067,王晨,科威特,安徽省晶市黄浦方路l座 527018
544,341124193011106126,杨健,也门,四川省红梅市海陵魏街A座 814710
545,350783194504141657,赵丽丽,圭亚那,山东省张家港市城东艾路Q座 518610
546,610423198503114453,宋柳,海地,西藏自治区深圳县滨城广州路B座 950550
547,520000197901250642,白健,安提瓜和巴布达,浙江省哈尔滨市新城太原街O座 879397
548,411722197402124950,何博,葡萄牙,湖南省深圳市清河董路p座 105265
549,210381196507122447,孙浩,洪都拉斯,辽宁省文市萧山佛山路b座 971013
550,41022319740916454X,王建,厄立特里亚,河北省宁德县上街严路B座 764164
551,360921193209217849,郑凤兰,巴拿马,江西省柳州县东城魏路N座 323594
552,150200194309154529,胡建,所罗门群岛,江苏省淑兰县高坪邓路U座 740293
553,410704198411097035,欧志强,澳大利亚,重庆市北京县静安韦街H座 235311
554,440825195803031966,陈秀兰,瓦里斯和富士那群岛,广东省芳县大东海门街k座 514921
555,652922196510011322,胡柳,保加利亚,四川省澳门县静安汕尾街d座 709848
556,340721198912181153,王龙,坦桑尼亚,重庆市巢湖市南溪澳门街w座 131548
557,150526196406150940,张飞,圣多美和普林西比,陕西省鹏市大东张路B座 919804
558,610621196110130144,徐英,加纳,山东省荣市黄浦黄街t座 500532
559,530425198902074500,张燕,捷克,天津市凤兰县西夏白街Q座 859529
560,23080319981001193X,陈海燕,尼加拉瓜,黑龙江省林县门头沟台北街u座 157541
561,210112197506261411,刘玲,梵蒂冈,江苏省阳市吉区刘街p座 458444
562,360723193608239406,邹玉兰,利比里亚,宁夏回族自治区金凤市梁平李路k座 400574
563,620522194110029015,刘桂芳,圣诞岛,湖南省桂珍县东丽汕尾街P座 323530
564,360824193909168615,罗建军,也门,天津市鹏县城东杭州路F座 148752
565,140701196509141176,饶红,伯利兹,天津市华县璧山梁街j座 522584
566,51160219761101198X,唐桂花,留尼汪岛,台湾省南京市魏都林街Y座 845766
567,510921194003165417,万利,法属圭亚那,浙江省武汉市浔阳深圳街y座 764750
568,650106193407168074,雷旭,莱索托,河北省建市静安王街A座 405310
569,46020519530706799X,刘凤英,安哥拉,海南省昆明市平山杨街N座 300224
570,120101198410313153,何艳,法属波里尼西亚,北京市玉兰市锡山赵路T座 636238
571,34120019460812836X,杨凤兰,奥地利,海南省宜都县吉区哈尔滨街y座 993862
572,331024195701217335,李玉华,巴拿马,台湾省岩县吉区成都街U座 157442
573,13050219540113917X,杨林,巴林,海南省荆门市城北柳州路H座 499381
574,340304195703299962,赵秀芳,蒙特塞拉特岛,山东省荆门市西夏盛路C座 861816
575,422802198403125290,王晨,科科斯岛,福建省海口市新城大冶街Y座 898879
576,330324193806170218,冯文,埃及,青海省婷婷市孝南沈阳街s座 661293
577,632723194003245960,石丽,桑给巴尔,云南省杨市上街张家港街k座 538521
578,341124197209035851,王萍,肯尼亚,贵州省关岭市孝南潮州路c座 628192
579,370283193011035962,刘超,菲律宾,台湾省西安县清河上海街Z座 642811
580,421321196710016432,商静,乌兹别克斯坦,四川省武汉县怀柔巢湖路o座 394910
581,640303196307083042,袁娜,牙买加,香港特别行政区斌县华龙广州街K座 654579
582,211402194604218696,刘桂英,加拿大,湖南省海口市沈河闵街V座 472579
583,652300195704116442,吴建,柬埔塞,湖南省郑州市花溪合肥街U座 133412
584,610727199303022243,吕强,科科斯岛,甘肃省柳州市黄浦刘街q座 934545
585,140824196701164423,周岩,马绍尔群岛,天津市浩县六枝特宜都路P座 418198
