jid,sfzh,xm,gj,address
0,620900198806101603,杨婷婷,哈萨克斯坦,新疆维吾尔自治区秀梅市安次宜都路q座 694721
1,230707199206246230,苏红霞,所罗门群岛,重庆市晶市上街澳门路E座 305307
2,513228194310255411,严杨,布隆迪,甘肃省广州市沙市南宁街S座 993597
3,231101194504124626,张莹,阿鲁巴岛,贵州省浩市沙市范街w座 963615
4,542132197802091940,周丽,克罗地亚,辽宁省瑞县孝南张路w座 139439
5,411401194501224859,周莹,波兰,福建省飞县花溪合肥路L座 619863
6,210881194307264123,赵倩,阿塞拜疆,云南省丽娟市长寿兴安盟路G座 940098
7,440000194302074145,周浩,莫桑比克,山西省博市江北梧州街X座 711141
8,511300193703277040,陈萍,朝鲜,甘肃省郑州市和平龚街u座 152838
9,410882194911118978,柴兵,哥斯达黎加,辽宁省南昌县安次张路X座 873554
10,370282199706181799,张玉珍,缅甸,青海省红梅市梁平嘉禾街P座 283107
11,350104198608052763,林帆,摩纳哥,广东省汕尾市徐汇海门街C座 616114
12,652826196902103939,吴静,圣马力诺,吉林省利市白云王街o座 312852
13,654201195106250513,张娜,夏威夷,宁夏回族自治区通辽县清浦邯郸街F座 819041
14,652927195110136713,孔龙,圣赫勒拿,福建省香港市长寿韦路v座 942730
15,659002195003257333,张秀芳,西撒哈拉,澳门特别行政区玉珍市丰都呼和浩特路A座 724956
16,210803197707066091,王雪梅,土耳其,澳门特别行政区兴城县清河杨路J座 871048
17,520181197501200295,崔倩,越南,台湾省小红市海陵杭州街G座 558561
18,12000019871014461X,谢宁,马尔代夫,宁夏回族自治区云县金平邯郸街g座 959336
19,441481193604128352,王宁,阿曼,北京市桂兰市高坪西安路d座 522945
20,341203197808153335,梁小红,维尔京群岛,河南省淮安县崇文韦路x座 844901
21,320724196808132040,陈淑珍,赤道几内亚,贵州省汕尾县丰都曹路t座 297540
22,510500193010099050,陈丽华,约旦,湖北省惠州市龙潭马鞍山路L座 792313
23,370902193504303793,许波,澳大利亚,云南省张家港县南湖南宁路S座 199889
24,441621193208132100,农琴,以色列,浙江省洋市高坪长沙路x座 865347
25,450331197906090986,刘岩,东萨摩亚,湖北省建国县璧山哈尔滨街t座 948702
26,150924200004110098,侯军,维尔京群岛,四川省旭市和平昆明路j座 681317
27,37010419480220552X,邓婷,多米尼加共和国,广西壮族自治区丽丽县蓟州崔路r座 791421
28,330424197203228293,崔凯,利比亚,河南省飞县沈河成都路H座 857637
29,542521194110144617,周建国,几内亚,河南省武汉市友好蔡街e座 438601
30,411422195403205116,曹鑫,斯威士兰,广西壮族自治区建华市门头沟潜江路x座 875311
31,222401200005047439,林鑫,摩纳哥,广西壮族自治区成都市闵行赵路s座 657449
32,410581195712222715,赵晶,扎伊尔,甘肃省银川县丰都兴城街p座 245632
33,440700198401018719,周平,塞内加尔,澳门特别行政区广州县吉区杭州街a座 472629
34,150703196006142980,王鹏,也门,台湾省兰州市长寿吴路u座 694487
35,341203196702264622,黄亮,阿曼,河北省柳市西峰吴街M座 571950
36,360600195205142852,黄荣,开曼群岛,江西省秀芳县崇文张路g座 816999
37,440203199003267695,田斌,利比里亚,上海市香港市城北初路i座 780176
38,320113194506027551,陈凤兰,格鲁吉亚,海南省长春市蓟州姚路U座 849832
39,220301197909100851,杨志强,英国,山西省嘉禾市朝阳刘路E座 342465
40,41162519660120221X,赵俊,开曼群岛,辽宁省莹县南长辽阳路H座 349181
41,430405198103226943,彭文,牙买加,青海省帅县孝南哈尔滨街D座 366765
42,650121194601086142,吴宇,巴西,西藏自治区玉珍市新城宁德街i座 836543
43,140122193101133581,黄丽,安圭拉岛英,黑龙江省芳县怀柔南昌路j座 351187
44,450325196412215732,蔡辉,乌克兰,福建省楠县沙市上海路K座 416594
45,360622196009275650,梁凤兰,瑞士,江西省桂英市滨城谢街e座 656039
46,321100197411174623,张杨,瓜德罗普岛,广西壮族自治区梧州市门头沟阚街W座 498666
47,430382199811249072,赵玉,泰国,山东省斌县静安刘街a座 791063
48,350581197910226736,安丽娟,尼日尔,天津市丹丹市南湖南昌路l座 681373
49,130629197205017567,韩桂兰,瓜德罗普岛,青海省南京市兴山乌鲁木齐街J座 897836
50,360921197103236900,刘桂珍,几内亚比绍,上海市梅市西峰朱街g座 856854
51,361126198106184417,王桂花,马来西亚,广东省秀珍县友好丁街F座 760513
52,130728197910318604,黎俊,新加坡,北京市合山市沈北新巢湖路X座 383151
53,220103197008016806,陆丽丽,新喀里多尼亚群岛,宁夏回族自治区文市南湖邹路I座 127964
54,140502194007314635,王倩,保加利亚,广西壮族自治区丽华县南长陈路Z座 165812
55,420102199606220743,郑春梅,希腊,河北省澳门县涪城王街B座 212057
56,341000193902133711,杨建,维尔京群岛和圣罗克伊,河北省梅县孝南齐齐哈尔路A座 573377
57,370687197303105307,关桂荣,利比亚,广西壮族自治区亮县崇文赵街y座 212332
58,520624196601306797,韦玉华,玻利维亚,甘肃省成县徐汇哈尔滨路g座 146184
59,130638197812122752,张秀荣,百慕大群岛,福建省兰州县南湖叶路q座 126021
60,360401198901293426,李桂香,梵蒂冈,广东省玲市永川通辽路v座 930264
61,320507195409128165,李秀梅,夏威夷,河南省桂兰市华龙何街V座 338887
62,211403196204281640,屈莹,东萨摩亚,云南省志强市东丽吴路r座 662367
63,650103197710034123,陈浩,波多黎各,北京市晨市孝南伍街p座 835799
64,620422198406295323,周成,秘鲁,西藏自治区潜江市孝南郭路C座 145657
65,321311200112204487,尹畅,西班牙,浙江省海门市清城南宁路X座 978220
66,350725197708124760,许颖,苏丹,河北省北京县蓟州长春街u座 724322
67,330411194708105285,丁金凤,牙买加,内蒙古自治区鹏县萧山胡街R座 541242
68,530922200105130897,吴刚,中华人民共和国,新疆维吾尔自治区西安县江北太原街Q座 731531
69,140929196701136075,孟秀云,赞比亚,四川省宜都县璧山成街W座 573209
70,440113195001313458,郑芳,迪戈加西亚岛,北京市秀珍县江北汕尾街I座 483101
71,450303195504137492,赵波,摩尔多瓦,澳门特别行政区桂芝县牧野高路l座 904571
72,654325198003126544,李建国,古巴,云南省雪梅市东丽西宁街D座 125995
73,411023194202085410,刘玉珍,福克兰群岛,四川省杰市翔安陈路n座 706773
74,530924196503136817,黄丹,卡塔尔,海南省六盘水市沈河台北路N座 217746
75,140829199406014348,刘丽娟,爱尔兰,湖南省建国县萧山张街u座 470829
76,500223198303195555,华波,瑞士,广东省兰英县翔安海门路R座 542713
77,440116199511171389,李淑英,帕劳,吉林省阜新市涪城赵街I座 923224
78,210000198512029225,梅丹,迪戈加西亚岛,香港特别行政区永安市黄浦李路u座 363754
79,140827194802244158,胡冬梅,缅甸,广东省淑华市房山通辽街e座 805166
80,370283197612149832,王柳,圭亚那,澳门特别行政区雪梅市双滦辽阳路L座 477956
81,522631195805308146,蒙雷,西撒哈拉,香港特别行政区璐县牧野梧州街k座 627499
82,500110196805202384,陈楠,孟加拉国,甘肃省兵市静安惠州街z座 225666
83,513429199907042929,徐强,柬埔塞,山东省英市蓟州谢街x座 485580
84,520501194205129451,张琳,冰岛,甘肃省军县清浦天津街Q座 490306
85,533400196105044591,杨凯,百慕大群岛,四川省鑫市合川周路P座 413336
86,130927193707104471,平楠,新加坡,河南省玉珍市涪城张路Z座 644899
87,654224195609140169,褚娜,纳米比亚,海南省浩县蓟州邯郸路l座 429582
88,230204196705183019,周晨,冈比亚,天津市红霞县上街胡街d座 759841
89,360104199211183518,陈鹏,喀麦隆,福建省永安县怀柔李街z座 368082
90,340104195605241192,钱利,玻利维亚,海南省磊市静安呼和浩特路T座 993341
91,659003199904040435,覃晨,塞浦路斯,青海省关岭市秀英刘路f座 100637
92,520324198502192168,田琴,乌兹别克斯坦,澳门特别行政区雪县龙潭深圳路c座 386403
93,440281199601106858,王红,几内亚比绍,内蒙古自治区长沙县大东李路m座 715643
94,370283193911161825,梁娜,布基纳法索,北京市兴城市普陀六安路N座 223239
95,530822196511038688,萧林,蒙特塞拉特岛,台湾省汕尾县东城冯街N座 274527
96,130401199009249274,李阳,维尔京群岛和圣罗克伊,甘肃省荆门市崇文齐齐哈尔街Y座 160129
97,511502198911091001,陈秀芳,卢旺达,重庆市巢湖县闵行宁德路b座 344972
98,520121197802219831,范红,安提瓜和巴布达,吉林省辉县崇文黎路U座 926882
99,433124195308035202,胡刚,伊拉克,澳门特别行政区博市龙潭俞街r座 659895
100,440904194901243865,杨琳,马绍尔群岛,山东省玉梅市黄浦淮安路v座 411262
101,340181194806068777,贺婷,立陶宛,山西省广州市闵行大冶街n座 134586
102,420624200003030896,娄桂芳,贝宁,贵州省永安市山亭仲街H座 646748
103,420624199912048457,张军,留尼汪岛,福建省太原县高港王路x座 691345
104,230402193309183142,张利,法属圭亚那,天津市勇县合川张路X座 157904
105,350521193311278871,钟柳,科科斯岛,重庆市秀芳县魏都陈路g座 415645
106,450300199512293275,杨桂香,多哥,香港特别行政区澳门市普陀上海街f座 773644
107,411282195906154862,刘超,巴西,黑龙江省上海县山亭惠州路Y座 497306
108,411724194409075900,吴雷,喀麦隆,黑龙江省志强县金平成都路O座 452046
109,460201196306176210,高佳,塔吉克斯坦,台湾省丽县牧野汕尾街B座 606003
110,652302193411170078,张洁,阿塞拜疆,北京市淑华县蓟州吴路S座 769855
111,542624194011108279,魏楠,吉布提,澳门特别行政区利市高坪陈路N座 455507
112,420800195703126086,江桂兰,吉布提,西藏自治区海口市兴山雷街v座 615599
113,469000198010210934,陈雪,马耳他,甘肃省亮县沈河刘路h座 278965
114,530827196108093566,张旭,南非,重庆市合山市丰都熊街k座 232436
115,62072219981013643X,王淑珍,保加利亚,浙江省杭州县东城李街T座 168918
116,620502198501025583,黄莉,马来西亚,山西省龙市清浦太原街Q座 410836
117,513338197907238472,高莉,马其顿,上海市大冶县孝南辽阳路f座 166014
118,231025193204265970,李帅,乌克兰,安徽省娜市大东梁路G座 932872
119,130522198209175655,韩淑兰,科威特,四川省香港县闵行南宁街J座 521101
120,230505199702193015,王秀英,马达加斯加,澳门特别行政区永安县梁平崔路a座 158759
121,36102119931211330X,金玉华,斯威士兰,江苏省燕县大兴哈尔滨路T座 835951
122,410204194411084423,刘玉,马其顿,黑龙江省沈阳市蓟州李街m座 648446
123,231005196701304086,王洁,索马里,西藏自治区琳市沙市辽阳街W座 184115
124,433122193305291161,侯秀芳,厄立特里亚,贵州省琳县大东黄街V座 284367
125,210181198107055319,王琳,马约特岛,四川省瑞市普陀何街g座 667459
126,431123194910312513,覃桂香,哈萨克斯坦,新疆维吾尔自治区兰英市沙湾永安街N座 265816
127,370304197204256989,蒙欣,阿尔及利亚,甘肃省佳县崇文汪街B座 916992
128,422826199408300647,丁雪,澳大利亚,山东省淑英市大东张街z座 516603
129,652823195012237974,袁鹏,所罗门群岛,湖北省岩县海港张街r座 644288
130,341021195110227745,王玉梅,圣赫勒拿,上海市伟县长寿胡街x座 296241
131,131022197205141000,金慧,西班牙,天津市桂香市永川石家庄路n座 215932
132,510303196109121731,江佳,缅甸,山东省杭州市东城张街Q座 474534
133,542226200110156531,贺建平,直布罗陀,山东省天津县锡山许路A座 843076
134,431228195502132603,魏红,意大利,北京市马鞍山市华龙阜新街t座 261605
135,430701199307207133,刘瑜,以色列,重庆市潮州市浔阳关岭路k座 533057
136,450481199708047037,安飞,牙买加,河北省瑞县沈北新张街V座 973768
137,450305197104289907,赵鑫,维尔京群岛和圣罗克伊,澳门特别行政区海门县朝阳何街I座 766638
138,513300197809061395,张琴,中途岛,江西省浩县淄川马鞍山路e座 908110
139,621101198809025478,宫利,爱沙尼亚,云南省平县华龙王路B座 172463
140,320612196412155093,雷婷,所罗门群岛,河南省张家港市长寿辛集街N座 175520
141,21102119611106834X,郭凤兰,卢森堡,浙江省峰市滨城澳门路i座 308537
142,62102119820825155X,刘洁,荷兰,上海市沈阳县房山华街B座 435474
143,610628197608193037,廖亮,桑给巴尔,山东省成都县闵行赵街y座 168784
144,330000197312186376,姚丽丽,圣文森特岛,江西省哈尔滨市沙市北京街E座 100178
145,231003197111172994,罗娟,阿拉伯联合酋长国,香港特别行政区琳市白云乌鲁木齐路n座 867711
146,411082193601058132,屈晨,中途岛,贵州省玉英县双滦贾街U座 903817
147,230800196907097116,余斌,蒙古,浙江省宜都市滨城李路d座 676781
148,61083119381230791X,罗桂芳,布隆迪,山东省斌县清浦朱路P座 648106
149,43048219470903625X,徐静,洪都拉斯,澳门特别行政区文市六枝特吕街J座 113433
150,510184197910159024,赵宇,夏威夷,香港特别行政区宜都市黄浦郭街a座 414151
151,520602197112130782,马玉,维尔京群岛和圣罗克伊,江苏省合山市六枝特潮州街z座 428386
152,513327199704039940,谢建,玻利维亚,陕西省丽县徐汇郭街M座 262023
153,220421197910032818,张文,乌干达,广西壮族自治区潜江市南长太原街O座 681209
154,370923194912195871,罗坤,阿尔巴尼亚,湖北省丽县和平香港街d座 809905
155,110117197904137799,刘飞,塞浦路斯,浙江省杭州县龙潭刘街k座 246506
156,341623198511111013,贺洁,伯利兹,内蒙古自治区海口县滨城刘街M座 809878
157,430624193403091451,李平,科特迪瓦,贵州省西安县和平田路y座 906032
158,341102196802225266,张平,美国,重庆市潜江县永川鞠路C座 175706
159,211403194912305544,陈洁,厄瓜多尔,新疆维吾尔自治区台北市滨城熊街P座 616375
160,410500197801173274,罗静,缅甸,宁夏回族自治区柳州县黄浦张路M座 892970
161,37082919370328119X,左洋,多米尼克国,上海市西宁市秀英陈路V座 114162
162,430422197408291254,刘莉,以色列,山西省玉兰县孝南杭州街i座 734283
163,43112819531015057X,王丽,索马里,江苏省淑兰市徐汇陈路w座 987457
164,141030197409191730,万辉,索马里,山西省石家庄市沙湾宜都路L座 212451
165,620982198408199929,任林,纳米比亚,江苏省淑英市永川海门路l座 612054
166,361123198803275243,陈敏,玻利维亚,云南省通辽县合川薛路g座 359210
167,451481195801073531,汪秀华,列支敦士登,宁夏回族自治区淑兰市山亭熊路o座 174259
168,230306198103311201,黄桂珍,特克斯和凯科斯群岛,山东省冬梅县清浦李路b座 773788
169,513430196407034385,李艳,刚果,贵州省洋市永川刘路K座 685325
170,230229193909259023,马东,佛得角,台湾省慧市永川王街Q座 608206
171,32072319880204582X,武桂英,维尔京群岛和圣罗克伊,福建省欢市清城惠州路A座 642653
172,370285196208097952,陈秀珍,新喀里多尼亚群岛,陕西省上海市清城陈街x座 389901
173,511024193703033251,牛桂荣,法国,青海省福州县清河萧街v座 424812
174,23060019920409152X,王莉,塞舌尔,宁夏回族自治区英市和平孙街A座 720930
175,611021199512097158,陈玉珍,图瓦卢,河南省敏县大东齐齐哈尔街X座 135298
176,542424199107048049,李倩,佛得角,浙江省俊县南溪长沙路d座 234029
177,61063019550501625X,莫畅,巴拿马,重庆市呼和浩特市长寿李街v座 841853
178,62110219880207680X,钟英,中途岛,上海市小红市新城宜都路W座 202108
179,450924194411255713,王桂荣,科摩罗,福建省海口市大东任路j座 156947
180,511324195410223348,李宇,塞浦路斯,黑龙江省张家港市江北齐齐哈尔街V座 910691
181,411522194112162057,贾桂芝,西撒哈拉,天津市永安县牧野六盘水路j座 234473
182,220402194805144866,马宁,委内瑞拉,云南省云县东城深圳路P座 581360
183,610702195309146698,周帆,海地,安徽省杭州县魏都宜都路r座 675690
184,441523194910248295,蔡兵,巴林,湖北省马鞍山市萧山林路r座 580031
185,140928195008062230,许瑜,玻利维亚,江西省海门县高明刘路w座 291024
186,532622198308234800,傅娜,桑给巴尔,新疆维吾尔自治区敏县黄浦庞街g座 409772
187,511132195311048571,王瑞,尼加拉瓜,云南省通辽县高明江街a座 804303
188,230801193509125065,王桂兰,格林纳达,新疆维吾尔自治区晶县安次哈尔滨街J座 162048
189,350900193004244866,陈梅,阿根廷,北京市欣市牧野熊街H座 728576
190,321281196011188726,张凤英,乌克兰,山西省香港市门头沟武汉街r座 241996
191,211322193902014486,韩红,乌干达,福建省丹市南溪张街O座 929842
192,421102195909294662,潘帆,莫桑比克,江西省凤英市吉区天津街K座 615150
193,653130197201195887,覃雪,哈萨克斯坦,辽宁省南宁县永川长春路C座 730079
194,64010119650208862X,陈玉英,洪都拉斯,四川省郑州县丰都李街x座 931982
195,540121197711081922,方明,留尼汪岛,浙江省冬梅县东城庞路K座 305320
196,350581197701259793,傅楠,日本,澳门特别行政区雪县高坪魏路s座 726605
197,141182194212188448,毛桂芝,摩尔多瓦,浙江省淑英县西峰阎路X座 810192
198,140522194610108938,陈想,不丹,安徽省娜市东丽张路h座 439403
199,230708198005165380,夏玉英,厄立特里亚,安徽省英市友好郁街u座 763550
200,341824198209214836,曹玲,桑给巴尔,上海市郑州县西夏杭州街b座 334477
201,441625194303195791,刘荣,危地马拉,甘肃省兴城县金平廖路O座 209889
202,440981193907208428,陈兰英,安圭拉岛英,吉林省勇市江北陈街v座 447646
203,210411197005166440,罗博,圣克里斯托弗和尼维斯,吉林省雷市大兴姚街c座 376476
204,610481193812047291,姜莹,泰国,吉林省雪梅县大东张家港路Y座 724800
205,653101197002217594,何超,马里,江西省彬市城北拉萨街y座 366625
206,230624199001257009,周磊,孟加拉国,上海市婷婷县海港乌鲁木齐街T座 120487
207,652122196208171997,梁丹丹,阿森松,吉林省邯郸市长寿石路O座 271304
208,232700194206160167,杜辉,立陶宛,山西省林市江北潮州街j座 727509
209,610823199509140544,王秀荣,博茨瓦纳,香港特别行政区荆门市沙湾谢街K座 112736
210,140201195009189008,陈玉英,埃塞俄比亚,福建省秀英县锡山曲路L座 874498
211,211122196304281763,王桂香,波多黎各,福建省燕县海陵李路P座 459339
212,210802193207013677,王丹,印度尼西亚,贵州省建军县清城谭路Q座 460967
213,620301193503031872,覃杰,立陶宛,辽宁省志强县平山芦路q座 948829
214,520423197111041316,辛燕,巴拉圭,湖南省艳县城东张路O座 192038
215,450521193002126691,陈晨,利比亚,新疆维吾尔自治区春梅县城北成都路x座 581646
216,520628199709085091,朱想,瓜德罗普岛,广西壮族自治区秀云县上街辛集路X座 493557
217,520324196503066447,赵凯,肯尼亚,江苏省辉市高港台北路d座 675752
218,15062519901107187X,郭利,毛里塔尼亚,陕西省深圳县永川南宁路a座 369468
219,620825195811245829,林秀兰,塞内加尔,香港特别行政区南宁县金平孙街q座 360530
220,320508199205083772,李小红,尼泊尔,青海省雪县丰都董路A座 753410
221,469002199301282476,毛洁,圣克里斯托弗和尼维斯,安徽省磊县沈北新李街j座 710958
222,510000197412212395,刘秀云,泰国,黑龙江省海门市高坪吴街P座 497324
223,341503197105098276,张瑞,巴林,浙江省北京县浔阳毛路q座 897252
224,330702194310271806,袁建军,帕劳,湖南省凤兰市清浦济南路r座 909004
225,370901197303046331,刘艳,玻利维亚,黑龙江省伟市锡山潜江街A座 962191
226,360400193206205616,姚秀梅,乌兹别克斯坦,河北省合肥市蓟州太原路v座 864471
227,230381198510249396,李华,关岛,浙江省丽娟县滨城南京街i座 256411
228,542424199403281195,王凤英,阿拉斯加,浙江省斌市双滦吴路n座 590478
229,500229195009202683,陈波,叙利亚,河南省秀珍市孝南哈尔滨路w座 515472
230,542626197902097995,王艳,贝宁,宁夏回族自治区沈阳县魏都甄街y座 996922
231,621021195402186196,王敏,泰国,山西省琳市房山惠州街C座 984248
232,140226199710151353,赵阳,布隆迪,澳门特别行政区银川市东城王路Y座 227199
233,15092119841017619X,王旭,格鲁吉亚,海南省潮州市滨城李路y座 765948
234,211201197110102446,王林,肯尼亚,安徽省淑兰市兴山胡街N座 842425
235,371311196610280968,罗利,塔吉克斯坦,香港特别行政区建县丰都太原路V座 876704
236,533124198409307358,朱玉梅,索马里,安徽省琳县清城刘路R座 628680
237,451023196608045204,李峰,约旦,山西省淮安市清浦李街h座 665764
238,36100019701227504X,章桂兰,阿富汗,江西省琳县平山王路Q座 835631
239,331181194304253277,艾芳,伯利兹,香港特别行政区兴城县永川窦路r座 532872
240,440511195009219289,张淑珍,格鲁吉亚,江西省志强县西夏汤路q座 765432
241,630105193810203095,甘鹏,刚果,河南省北镇市普陀王路O座 359818
242,370881199705118305,冯亮,布基纳法索,山西省华市友好西宁路z座 474295
243,440785194809136298,黎建华,波兰,山东省杭州市大东郑路j座 122066
244,610426197309113734,王淑英,吉尔吉斯斯坦,河北省桂香县沈河银川路V座 123896
245,511502197704135361,韩雪,约旦,安徽省深圳县清河柳州路B座 523796
246,429000198909050572,王淑兰,哥斯达黎加,河北省英市东丽张街K座 254115
247,350203193102223066,梁雪,斐济,北京市沈阳县普陀赵路T座 722927
248,460300194304198547,黄桂花,新加坡,山西省西安县大兴林街T座 428391
249,450102199105248890,徐阳,奥地利,江西省台北县海陵何路L座 269811
250,450304198803043998,傅洁,冰岛,河南省建华县西峰海门路U座 219989
251,360425199907041225,郝志强,科威特,陕西省凤英市安次澳门路B座 356590
252,41030119680930716X,武俊,尼日尔,贵州省郑州市门头沟成都路A座 589447
253,210282195404252245,李秀英,荷属安的列斯群岛,浙江省荣市门头沟石家庄路g座 368436
254,330903194404134092,刘玉华,蒙特塞拉特岛,安徽省霞县吉区郭路C座 555777
255,130801196607255373,陶冬梅,乌拉圭,安徽省彬市门头沟哈尔滨路s座 785630
256,611021198803025184,苏秀荣,扎伊尔,西藏自治区玉县南长李路J座 560984
257,360727199110142749,陈艳,亚美尼亚,天津市兴城县和平黄路W座 882672
258,430204193504243736,白玉兰,关岛,北京市深圳县沙湾张街y座 621422
259,410182197005127480,封雪梅,莫桑比克,香港特别行政区贵阳县合川李街y座 427352
260,350102196001074470,张丹,密克罗尼西亚,山东省沈阳市萧山彭路P座 882147
261,511827196401137502,郑瑜,新喀里多尼亚群岛,台湾省俊市淄川惠州街c座 167601
262,320118199503034646,彭博,柬埔塞,云南省西宁市城东六安街k座 644290
263,140122194312139638,王龙,苏丹,贵州省邯郸市丰都罗街p座 861213
264,130902199405070237,赵兰英,朝鲜,河南省倩市新城高街X座 680676
265,140108193704177519,林梅,葡萄牙,江西省兴安盟市江北深圳街q座 180885
266,210901198508191188,孙浩,马里亚纳群岛,山西省桂香市东城哈尔滨路m座 901342
267,341300193201087544,陶兵,圣马力诺,甘肃省建国县大东福州路E座 608143
268,370686196604068406,韩凤兰,赤道几内亚,青海省超市普陀拉萨路z座 908451
269,331001195604104000,张凤兰,巴林,湖北省燕县沙市邯郸路M座 156221
270,451422197709223364,吴琳,福克兰群岛,贵州省汕尾县高明陈街P座 460349
271,430221196101291151,杨欣,马提尼克,山东省帆市长寿李路F座 237706
272,522725195310086834,白敏,诺福克岛,辽宁省太原市南溪彭街Y座 880499
273,210781199705154998,安洋,卢森堡,云南省惠州县沈北新惠州街g座 599651
274,450124193402073362,孙芳,巴布亚新几内亚,青海省雪县沈河李街o座 628295
275,430600193107175713,罗莉,拉脱维亚,北京市辛集县魏都黄街y座 911032
276,360502193507065168,王秀芳,委内瑞拉,江西省梧州市安次嘉禾街l座 326937
277,411103196605022149,杨勇,圣卢西亚,福建省兴城县长寿蔡路g座 899095
278,610328194308224866,秦玉梅,特立尼达和多巴哥,广东省敏县安次杭州路r座 493062
279,150923194606242384,吕琴,几内亚比绍,广东省华市海港哈尔滨路R座 717461
280,511301199602052911,林凤英,英国,河南省春梅市高坪高街D座 123971
281,330106194410208006,陈云,纳米比亚,陕西省兴城县魏都郑州街R座 524288
282,54223219550612680X,李丽娟,新加坡,内蒙古自治区马鞍山县沙市杜街K座 411943
283,130424198610305919,何冬梅,爱沙尼亚,香港特别行政区惠州县和平岳街P座 687940
284,440304198308170736,许娜,芬兰,重庆市成都县南长潜江路s座 596898
285,410181197408126136,翁梅,伊郎,广西壮族自治区澳门县孝南武汉路b座 831188
286,331021193707150102,赵利,列支敦士登,湖北省波市花溪王路R座 451291
287,451402194105204497,王晶,托克劳群岛,北京市涛市南长施街V座 276926
288,513431198309241140,孟梅,帕劳,吉林省飞县淄川陈街J座 457942
289,13068119680522996X,黄帆,南斯拉夫,新疆维吾尔自治区昆明县房山惠州街G座 256306
290,430121200003239265,宋想,关岛,台湾省浩市沙湾张街C座 870981
291,360427196611085113,蒙梅,古巴,吉林省辽阳市城东马鞍山街J座 121461
292,321323196501212006,袁文,维尔京群岛,青海省昆明市双滦陈街A座 471916
293,231025194705084005,陈浩,扎伊尔,安徽省娟县闵行师街u座 262840
