jid,sfzh,xm,gj,address
878,430701197602143954,汪桂珍,土耳其,台湾省北镇县高港狄路L座 650260
879,440104195310207425,周建军,波斯尼亚和黑塞哥维那,江苏省俊县新城关岭街c座 132450
880,44078519521009556X,罗超,博茨瓦纳,上海市惠州县魏都银川路t座 853936
881,610124196205072567,张彬,尼日利亚,辽宁省金凤市秀英董街j座 572081
882,621000195605097917,罗兰英,哥斯达黎加,山西省邯郸市沈北新深圳路T座 459762
883,130532196307152637,张洁,马拉维,浙江省丽娟县白云康街L座 327957
884,511302195105135781,郝淑华,突尼斯,甘肃省秀华县上街海口路N座 135940
885,623027197302083906,沈芳,巴巴多斯,海南省楠市普陀何路x座 796307
886,53253219780902576X,谢涛,法罗群岛,福建省俊市大兴长沙路e座 692384
887,532523200107194188,汪鹏,马约特岛,海南省莉市六枝特淮安街a座 947308
888,220605196206173680,张淑兰,马其顿,澳门特别行政区莉县花溪夏街p座 661054
889,330381196104223048,廖佳,乌克兰,香港特别行政区玲县和平林路M座 460709
890,542426193407181963,叶雪梅,卢旺达,广西壮族自治区武汉市合川赵路H座 154583
891,511111195807223837,罗洁,贝宁,湖北省福州县海陵柏街G座 745899
892,420301196308246639,胡凯,瑙鲁,浙江省拉萨市清浦荆门街G座 691694
893,632700199111077333,黄强,加拿大,黑龙江省丹市龙潭潜江路A座 676734
894,440881196209282936,罗云,伊郎,香港特别行政区颖县南长张路F座 239133
895,331102199611245805,贺秀兰,关岛,安徽省海门市东城赵路I座 820405
896,511000199810232017,崔颖,海地,辽宁省东莞县翔安汕尾路W座 558344
897,210200195403195504,刘旭,尼日尔,陕西省杭州县梁平柳州路J座 270069
898,653129199802029095,邓燕,马拉维,四川省福州市吉区庄街e座 553287
899,410301194701249253,陈东,马耳他,吉林省桂花市秀英何街o座 877152
900,450900194008037141,冯柳,奥地利,山西省丽华县金平长沙街T座 447414
901,532527196603023894,宗鑫,桑给巴尔,辽宁省长春市双滦南昌街A座 643956
902,360723198612204479,郭敏,吉尔吉斯斯坦,宁夏回族自治区昆明县涪城六安路p座 675205
903,654000196701079439,董娜,阿森松,广西壮族自治区南昌市秀英王路L座 884866
904,350925193408065466,王玉梅,博茨瓦纳,内蒙古自治区建国市沙市邓街Q座 290098
905,430203193108184272,李秀兰,开曼群岛,云南省丽华县西峰惠州街f座 784115
906,23122519620614080X,胡淑兰,图瓦卢,广西壮族自治区沈阳市魏都李路O座 442737
907,330802198005279784,孙凯,津巴布韦,吉林省大冶县朝阳李街S座 693418
908,370783196507208098,戴秀芳,以色列,西藏自治区杭州县璧山汕尾路p座 223209
909,141082198906188680,王桂荣,美国,台湾省萍市海港张街i座 280633
910,33092219991206482X,郭文,瑞典,贵州省汕尾县金平刘路r座 727584
911,231000196009126859,孙辉,波兰,贵州省雪市孝南合肥街P座 852612
912,511011197804047843,钟丽华,科威特,新疆维吾尔自治区南京县普陀柳州街e座 273934
913,370826199308233751,鞠杰,俄罗斯,内蒙古自治区文市海陵通辽街P座 463097
914,440513196002018588,刘涛,蒙古,西藏自治区凤英市和平澳门街M座 472646
915,431124196811197412,唐玉兰,瑞士,山东省丹县南长徐街u座 670296
916,530000196501064565,彭利,亚美尼亚,辽宁省红霞市牧野澳门街G座 238250
917,620801199601216082,温玉华,苏里南,西藏自治区东市友好潘路s座 432403
918,630102199803177317,马东,哈萨克斯坦,重庆市宜都市友好罗街P座 670733
919,440783194505191658,朱莹,安哥拉,四川省哈尔滨县友好昆明路b座 135314
920,350100193005298221,卢婷婷,斯洛伐克,黑龙江省沈阳县安次西安街x座 790726
921,520112196112251788,尹成,捷克,香港特别行政区南京市涪城郭街v座 429896
922,652201199504055795,赵玉,秘鲁,广东省关岭市南长齐齐哈尔路d座 775590
923,320205196011228882,戴红梅,安道尔,河北省重庆县金平王路B座 426135
924,513401197501271689,王桂芝,圭亚那,江苏省天津县城北台北街r座 210193
925,131100193405189972,丁博,瓜德罗普岛,广西壮族自治区太原市西夏南昌街D座 882490
926,52062319430831467X,蔡楠,越南,湖南省乌鲁木齐市萧山吕街T座 203417
927,320100196507289446,方海燕,白俄罗斯,天津市宁德县清城佛山街V座 885628
928,510302196405182233,俞明,智利,海南省桂芳县沙湾淮安路E座 513352
929,330101193311167898,乔桂芳,波多黎各,青海省关岭县六枝特沈阳街H座 346439
930,370403197204150999,李东,冈比亚,河南省红市高坪荆门路z座 162038
931,330302199402103851,廖峰,朝鲜,福建省上海县房山汤路l座 729703
932,361125193612114287,傅桂英,马提尼克,重庆市梅市高坪马鞍山街v座 421481
933,620301197412270526,杨燕,不丹,山东省建华市海港胡路k座 937021
934,130722193704063050,黄桂香,扎伊尔,陕西省秀珍县翔安王路E座 217589
935,620701194408211361,林建国,朝鲜,上海市桂兰县上街徐路V座 264198
936,150581195706242636,黄超,安圭拉岛英,西藏自治区呼和浩特市合川蔡街A座 273593
937,230109198110045771,唐坤,马尔代夫,山西省惠州县城北王路k座 943708
938,35062619751202200X,周玉英,关岛,西藏自治区重庆市合川周路r座 342336
939,620201194201195299,窦玲,法罗群岛,吉林省秀珍县金平鞠路Z座 299787
940,150802199309012406,杨海燕,沙特阿拉伯,澳门特别行政区帆市龙潭嘉禾街N座 483405
941,211081197909203767,沈想,巴拿马,山西省马鞍山市丰都深圳路Q座 651244
942,341825193403142243,朱婷,津巴布韦,广东省建华市华龙张路W座 168417
943,445301195903050642,谢坤,直布罗陀,上海市六盘水县城东南宁街B座 580662
944,360723194908262848,王玉华,圣文森特岛,贵州省辛集县璧山任路g座 321758
945,440232199607045470,胡晨,吉布提,新疆维吾尔自治区乌鲁木齐县大兴李路G座 698950
946,410883195003304960,罗桂花,圣卢西亚,天津市健市长寿李街i座 632393
947,320206197702284382,李云,乌兹别克斯坦,陕西省长沙市高明淮安路D座 214053
948,230803198506220062,林志强,巴哈马国,湖北省秀梅市牧野沈阳街h座 604111
949,421022198405144904,杨辉,留尼汪岛,黑龙江省金凤县永川杨街w座 905920
950,420526198906182652,陈淑英,芬兰,天津市健县闵行沈街U座 394251
951,441621197411051363,杨秀梅,开曼群岛,湖北省辉县和平魏路H座 495007
952,440233195311101785,姜波,留尼汪岛,北京市鹏县白云吕街B座 411916
953,530427199410213786,张淑英,以色列,宁夏回族自治区欣县白云武汉街Q座 339184
954,330203198703028003,徐玉华,斯里兰卡,甘肃省欣市新城吕路z座 687628
955,141130193805059747,郭红,肯尼亚,天津市楠市涪城程路m座 262487
956,220122197004200779,张海燕,印度尼西亚,吉林省阜新县崇文谢街N座 451297
957,410526195803033536,李婷婷,法国,天津市冬梅市蓟州柴路D座 387143
958,140521197406092278,毕柳,巴林,澳门特别行政区磊县江北梧州街B座 805507
959,540222194504221687,阿英,佛得角,新疆维吾尔自治区张家港市黄浦北京路N座 772661
960,230828194406129498,尹艳,刚果,河北省想县花溪辛集路c座 873472
961,370181193503070192,朱丽丽,卢森堡,海南省斌市六枝特潜江路n座 917767
962,44022219811231765X,黄飞,安提瓜和巴布达,重庆市通辽市清浦宋街v座 321239
963,140301200012055536,唐林,阿鲁巴岛,广东省重庆市崇文郑州路R座 103171
964,370181193606273291,何健,瑞典,重庆市燕市魏都邯郸路T座 979519
965,610102197704166046,葛彬,卢森堡,山西省利县沈河田街X座 601029
966,320582195903040660,詹强,伊拉克,江西省涛市大兴杨街g座 894139
967,530111198702173104,何文,中非,云南省伟市和平太原路D座 254271
968,360730194805171074,李佳,马提尼克,上海市岩县华龙赵街B座 272868
969,211221195006046030,钟燕,法罗群岛,湖北省杭州县东丽巢湖路H座 885060
970,360222198902222719,张勇,关岛,山东省香港县普陀天津街b座 616319
971,320104198301319771,任晶,尼加拉瓜,澳门特别行政区凤兰县萧山王街W座 905704
972,350481195605065118,甘洁,圣克里斯托弗和尼维斯,湖南省利市南溪东莞路l座 840250
973,500111197210113367,罗欣,卢旺达,香港特别行政区南京市城北梧州路J座 102745
974,210502196301062720,邵玉梅,斯洛文尼亚,澳门特别行政区秀英县永川呼和浩特路c座 216662
975,230124197609162343,戴俊,威克岛,上海市济南县华龙太原街a座 450092
976,621025193507275706,李桂珍,阿根廷,四川省惠州县秀英袁路G座 956885
977,321281194005040822,位璐,摩洛哥,河南省明县华龙宁德街m座 899074
978,431100196302206703,石凤英,布基纳法索,广西壮族自治区六安市黄浦刘路T座 333575
979,632802199402111755,莫宇,所罗门群岛,江苏省佳市大兴淮安路o座 325955
980,420100197206224372,王冬梅,葡萄牙,上海市磊市清河阜新街L座 713699
981,370281195208051129,陈成,意大利,广西壮族自治区兰州市永川王街t座 424423
982,140900197701117466,支丹丹,保加利亚,宁夏回族自治区济南市安次宁德路f座 113247
983,450500200109037948,梅杨,牙买加,山东省凤兰县崇文屈街g座 247578
984,340122193501215823,王岩,缅甸,江西省莉市闵行昆明街o座 544920
985,430223193512310512,李淑英,瓦里斯和富士那群岛,甘肃省北镇县友好韩路A座 936831
986,36100219710721084X,程成,沙特阿拉伯,贵州省杭州市大东呼和浩特街S座 908427
987,320707197902124854,曾倩,新西兰,甘肃省丽丽市城北拉萨路U座 345506
988,370786198008234150,钟慧,多米尼克国,宁夏回族自治区潜江市金平吴路v座 904047
989,610600195902096507,李鑫,南非,山东省长春县兴山宜都路w座 943422
990,361125198803287335,杨玉兰,托克劳群岛,河北省合山县南长北京街y座 937708
991,411525195312192174,黄阳,巴拉圭,山东省波县梁平张街V座 835992
992,621223200111257131,胡强,吉布提,贵州省秀荣县沈北新南宁路s座 188768
993,350901193204267006,马楠,莱索托,重庆市上海县南长林街h座 776101
994,370214200001066167,杜建华,英国,陕西省邯郸市南长合山路O座 236029
995,150404194103027109,谢建国,扎伊尔,海南省建县璧山邯郸路y座 188641
996,451100197810121640,范玉英,格鲁吉亚,浙江省昆明县平山关岭路x座 186941
997,440308193407167076,吴雪,马尔代夫,海南省桂香市锡山王街F座 218043
998,371202197907025311,曾浩,新加坡,山东省刚市浔阳董街W座 431781
999,411422193411159536,王秀珍,密克罗尼西亚,四川省林县大兴刘路a座 852087
